[
  {
    "id": 1,
    "course_id": 53,
    "classroom_id": 27,
    "exam_date": "2025-01-30",
    "exam_type": "resit",
    "duration_minutes": 90,
    "max_score": 10.0,
    "registered_students": 11
  },
  {
    "id": 2,
    "course_id": 265,
    "classroom_id": 5,
    "exam_date": "2023-04-06",
    "exam_type": "final",
    "duration_minutes": 90,
    "max_score": 10.0,
    "registered_students": 32
  },
  {
    "id": 3,
    "course_id": 16,
    "classroom_id": 91,
    "exam_date": "2022-11-07",
    "exam_type": "midterm",
    "duration_minutes": 45,
    "max_score": 10.0,
    "registered_students": 9
  },
  {
    "id": 4,
    "course_id": 194,
    "classroom_id": 106,
    "exam_date": "2025-06-16",
    "exam_type": "midterm",
    "duration_minutes": 60,
    "max_score": 10.0,
    "registered_students": 36
  },
  {
    "id": 5,
    "course_id": 285,
    "classroom_id": 49,
    "exam_date": "2024-03-12",
    "exam_type": "midterm",
    "duration_minutes": 60,
    "max_score": 10.0,
    "registered_students": 21
  },
  {
    "id": 6,
    "course_id": 121,
    "classroom_id": 1,
    "exam_date": "2024-04-22",
    "exam_type": "final",
    "duration_minutes": 150,
    "max_score": 10.0,
    "registered_students": 20
  },
  {
    "id": 7,
    "course_id": 262,
    "classroom_id": 7,
    "exam_date": "2023-03-27",
    "exam_type": "final",
    "duration_minutes": 180,
    "max_score": 10.0,
    "registered_students": 17
  },
  {
    "id": 8,
    "course_id": 121,
    "classroom_id": 6,
    "exam_date": "2023-09-14",
    "exam_type": "midterm",
    "duration_minutes": 45,
    "max_score": 10.0,
    "registered_students": 24
  },
  {
    "id": 9,
    "course_id": 291,
    "classroom_id": 71,
    "exam_date": "2025-06-12",
    "exam_type": "mock",
    "duration_minutes": 60,
    "max_score": 10.0,
    "registered_students": 13
  },
  {
    "id": 10,
    "course_id": 80,
    "classroom_id": 109,
    "exam_date": "2024-03-13",
    "exam_type": "mock",
    "duration_minutes": 90,
    "max_score": 10.0,
    "registered_students": 13
  },
  {
    "id": 11,
    "course_id": 160,
    "classroom_id": 12,
    "exam_date": "2025-04-25",
    "exam_type": "mock",
    "duration_minutes": 45,
    "max_score": 10.0,
    "registered_students": 9
  },
  {
    "id": 12,
    "course_id": 223,
    "classroom_id": 23,
    "exam_date": "2023-11-13",
    "exam_type": "midterm",
    "duration_minutes": 90,
    "max_score": 10.0,
    "registered_students": 19
  },
  {
    "id": 13,
    "course_id": 262,
    "classroom_id": 8,
    "exam_date": "2023-02-20",
    "exam_type": "final",
    "duration_minutes": 120,
    "max_score": 10.0,
    "registered_students": 23
  },
  {
    "id": 14,
    "course_id": 177,
    "classroom_id": 96,
    "exam_date": "2024-12-09",
    "exam_type": "final",
    "duration_minutes": 90,
    "max_score": 10.0,
    "registered_students": 21
  },
  {
    "id": 15,
    "course_id": 147,
    "classroom_id": 21,
    "exam_date": "2025-03-11",
    "exam_type": "mock",
    "duration_minutes": 90,
    "max_score": 10.0,
    "registered_students": 19
  },
  {
    "id": 16,
    "course_id": 133,
    "classroom_id": 115,
    "exam_date": "2023-10-11",
    "exam_type": "final",
    "duration_minutes": 120,
    "max_score": 10.0,
    "registered_students": 9
  },
  {
    "id": 17,
    "course_id": 296,
    "classroom_id": 44,
    "exam_date": "2024-10-16",
    "exam_type": "midterm",
    "duration_minutes": 60,
    "max_score": 10.0,
    "registered_students": 18
  },
  {
    "id": 18,
    "course_id": 67,
    "classroom_id": 115,
    "exam_date": "2022-11-14",
    "exam_type": "midterm",
    "duration_minutes": 45,
    "max_score": 10.0,
    "registered_students": 14
  },
  {
    "id": 19,
    "course_id": 151,
    "classroom_id": 69,
    "exam_date": "2023-10-09",
    "exam_type": "midterm",
    "duration_minutes": 60,
    "max_score": 10.0,
    "registered_students": 25
  },
  {
    "id": 20,
    "course_id": 97,
    "classroom_id": 42,
    "exam_date": "2022-10-31",
    "exam_type": "midterm",
    "duration_minutes": 90,
    "max_score": 10.0,
    "registered_students": 12
  },
  {
    "id": 21,
    "course_id": 199,
    "classroom_id": 58,
    "exam_date": "2024-03-11",
    "exam_type": "midterm",
    "duration_minutes": 60,
    "max_score": 10.0,
    "registered_students": 17
  },
  {
    "id": 22,
    "course_id": 293,
    "classroom_id": 48,
    "exam_date": "2023-03-13",
    "exam_type": "midterm",
    "duration_minutes": 90,
    "max_score": 10.0,
    "registered_students": 26
  },
  {
    "id": 23,
    "course_id": 49,
    "classroom_id": 16,
    "exam_date": "2022-09-20",
    "exam_type": "final",
    "duration_minutes": 60,
    "max_score": 10.0,
    "registered_students": 37
  },
  {
    "id": 24,
    "course_id": 209,
    "classroom_id": 25,
    "exam_date": "2023-05-01",
    "exam_type": "mock",
    "duration_minutes": 60,
    "max_score": 10.0,
    "registered_students": 21
  },
  {
    "id": 25,
    "course_id": 162,
    "classroom_id": 105,
    "exam_date": "2024-11-14",
    "exam_type": "mock",
    "duration_minutes": 60,
    "max_score": 10.0,
    "registered_students": 22
  },
  {
    "id": 26,
    "course_id": 42,
    "classroom_id": 70,
    "exam_date": "2025-04-28",
    "exam_type": "midterm",
    "duration_minutes": 60,
    "max_score": 10.0,
    "registered_students": 9
  },
  {
    "id": 27,
    "course_id": 245,
    "classroom_id": 31,
    "exam_date": "2024-03-07",
    "exam_type": "midterm",
    "duration_minutes": 45,
    "max_score": 10.0,
    "registered_students": 23
  },
  {
    "id": 28,
    "course_id": 250,
    "classroom_id": 27,
    "exam_date": "2022-12-12",
    "exam_type": "midterm",
    "duration_minutes": 60,
    "max_score": 10.0,
    "registered_students": 17
  },
  {
    "id": 29,
    "course_id": 259,
    "classroom_id": 117,
    "exam_date": "2024-05-22",
    "exam_type": "final",
    "duration_minutes": 90,
    "max_score": 10.0,
    "registered_students": 17
  },
  {
    "id": 30,
    "course_id": 162,
    "classroom_id": 103,
    "exam_date": "2025-06-19",
    "exam_type": "midterm",
    "duration_minutes": 45,
    "max_score": 10.0,
    "registered_students": 25
  },
  {
    "id": 31,
    "course_id": 3,
    "classroom_id": 24,
    "exam_date": "2022-12-12",
    "exam_type": "resit",
    "duration_minutes": 90,
    "max_score": 10.0,
    "registered_students": 21
  },
  {
    "id": 32,
    "course_id": 260,
    "classroom_id": 61,
    "exam_date": "2023-06-06",
    "exam_type": "midterm",
    "duration_minutes": 60,
    "max_score": 10.0,
    "registered_students": 20
  },
  {
    "id": 33,
    "course_id": 274,
    "classroom_id": 67,
    "exam_date": "2025-04-21",
    "exam_type": "mock",
    "duration_minutes": 90,
    "max_score": 10.0,
    "registered_students": 36
  },
  {
    "id": 34,
    "course_id": 106,
    "classroom_id": 120,
    "exam_date": "2025-04-11",
    "exam_type": "midterm",
    "duration_minutes": 90,
    "max_score": 10.0,
    "registered_students": 19
  },
  {
    "id": 35,
    "course_id": 117,
    "classroom_id": 46,
    "exam_date": "2024-05-06",
    "exam_type": "mock",
    "duration_minutes": 90,
    "max_score": 10.0,
    "registered_students": 19
  },
  {
    "id": 36,
    "course_id": 210,
    "classroom_id": 91,
    "exam_date": "2024-02-29",
    "exam_type": "midterm",
    "duration_minutes": 90,
    "max_score": 10.0,
    "registered_students": 13
  },
  {
    "id": 37,
    "course_id": 44,
    "classroom_id": 89,
    "exam_date": "2023-12-12",
    "exam_type": "final",
    "duration_minutes": 60,
    "max_score": 10.0,
    "registered_students": 8
  },
  {
    "id": 38,
    "course_id": 5,
    "classroom_id": 42,
    "exam_date": "2023-10-02",
    "exam_type": "mock",
    "duration_minutes": 90,
    "max_score": 10.0,
    "registered_students": 19
  },
  {
    "id": 39,
    "course_id": 95,
    "classroom_id": 23,
    "exam_date": "2024-12-30",
    "exam_type": "mock",
    "duration_minutes": 60,
    "max_score": 10.0,
    "registered_students": 23
  },
  {
    "id": 40,
    "course_id": 236,
    "classroom_id": 64,
    "exam_date": "2024-09-09",
    "exam_type": "resit",
    "duration_minutes": 60,
    "max_score": 10.0,
    "registered_students": 8
  },
  {
    "id": 41,
    "course_id": 285,
    "classroom_id": 56,
    "exam_date": "2023-12-22",
    "exam_type": "midterm",
    "duration_minutes": 90,
    "max_score": 10.0,
    "registered_students": 37
  },
  {
    "id": 42,
    "course_id": 199,
    "classroom_id": 60,
    "exam_date": "2024-06-20",
    "exam_type": "final",
    "duration_minutes": 150,
    "max_score": 10.0,
    "registered_students": 18
  },
  {
    "id": 43,
    "course_id": 298,
    "classroom_id": 87,
    "exam_date": "2023-02-17",
    "exam_type": "midterm",
    "duration_minutes": 60,
    "max_score": 10.0,
    "registered_students": 10
  },
  {
    "id": 44,
    "course_id": 166,
    "classroom_id": 100,
    "exam_date": "2023-02-17",
    "exam_type": "midterm",
    "duration_minutes": 45,
    "max_score": 10.0,
    "registered_students": 21
  },
  {
    "id": 45,
    "course_id": 154,
    "classroom_id": 114,
    "exam_date": "2025-03-31",
    "exam_type": "final",
    "duration_minutes": 60,
    "max_score": 10.0,
    "registered_students": 18
  },
  {
    "id": 46,
    "course_id": 287,
    "classroom_id": 87,
    "exam_date": "2022-11-09",
    "exam_type": "resit",
    "duration_minutes": 90,
    "max_score": 10.0,
    "registered_students": 18
  },
  {
    "id": 47,
    "course_id": 24,
    "classroom_id": 116,
    "exam_date": "2023-11-27",
    "exam_type": "midterm",
    "duration_minutes": 60,
    "max_score": 10.0,
    "registered_students": 17
  },
  {
    "id": 48,
    "course_id": 111,
    "classroom_id": 23,
    "exam_date": "2023-01-24",
    "exam_type": "midterm",
    "duration_minutes": 60,
    "max_score": 10.0,
    "registered_students": 8
  },
  {
    "id": 49,
    "course_id": 272,